name;title;description;year;tags
_DSC3849;Camporosso in Valcanale;Serene hilltop moments: A picturesque church gracing the hill, under a brilliant blue sky, while a plane leaves a trail behind, capturing the essence of tranquility from the middle of the hill.;2022;camporosso in valcanale-city-mountain-nature-landscape-winter-house-tree-church
_DSC3850;Camporosso in Valcanale;Elevated perspective: A panoramic view from a small hill capturing all the buildings nestled amidst the valley between majestic mountains.;2022;camporosso in valcanale-city-mountain-nature-landscape-winter-house-tree-home
_DSC3854;Camporosso in Valcanale;Sacred serenity: Capturing the Mount Lussari Sanctuary at the foot of the mountain, framed by the delicate embrace of overhanging branches;2022;camporosso in valcanale-city-mountain-nature-landscape-winter-house-tree-mount lussari
_DSC3856;Camporosso in Valcanale;Nature's tapestry unfolds: The majestic mountains and lush valley paving the way to the enchanting Camporosso in Valcanale;2022;camporosso in valcanale-mountain-nature-landscape-winter-house-tree
DSC_2248;Bibione;On the beach near the lighthouse in Bibione, the winter sun casts a soft, golden glow over the serene landscape. The low-angle sunlight bathes the sandy shore in a warm light, despite the chilly air, creating a striking contrast against the clear, crisp sky. The lighthouse stands tall and proud, its white facade gleaming against the azure backdrop, serving as a beacon of both guidance and beauty.;2022;bibione-sunset-beach-nature-sea-landscape-winter-golden hour
DSC_2276;Bibione;In Bibione, a picturesque path meanders between the beach and the surrounding natural landscape, bathed in the soft, golden light of a winter golden hour. The sun, low on the horizon, casts long, warm shadows, enhancing the natural beauty of the scene. The sandy trail is flanked by dunes and sparse, hardy vegetation, resilient against the winter chill.;2022;bibione-sunset-nature-landscape-winter-golden hour-tree-path
DSC_2288;Bibione;During the winter golden hour, sunlight filters through the trees, casting a warm and enchanting glow across the landscape. The low angle of the sun creates long, soft shadows that stretch across the ground, enhancing the texture and contours of the forest floor. Each beam of light appears almost tangible as it pierces through the branches, creating a beautiful interplay of light and shadow.;2022;bibione-sunset-beach-nature-sea-landscape-winter-golden hour-tree
DSC_2302;Bibione;During the winter golden hour, the sky is adorned with clouds that are beautifully tinged with warm hues of pink, orange, and gold. As the sun dips low on the horizon, its rays cast a radiant glow, illuminating the clouds from beneath and creating a stunning display of color. The soft, pastel tones contrast gently with the cool, crisp blue of the winter sky, adding depth and dimension to the scene.;2022;bibione-sunset-sky-nature-cloud-winter-golden hour
DSC_0290;Caorle;Tranquil waters tell tales of fishermen's endeavors, where the river gracefully splits, embracing boats that have returned from their fruitful fishing expedition.;2022;caorle-city-beach-sea-boat-house-building
DSC_0297;Caorle;A wooden jetty whispers stories of seaside serenity, capturing a glimpse of the sea and deserted beaches, as closed hotels stand as silent sentinels to the end of the season.;2022;caorle-city-beach-sea-boat-house-building-people
DSC_0312;Caorle;Embracing the charm of Caorle, the raised promenade guides the way to the Church of Our Lady of the Angel, where echoes of history mingle with the leisurely strolls of today.;2022;caorle-city-beach-sea-church-belltower-people-building
DSC_2321;Conegliano;At Conegliano Castle, basking in the warmth of a beautiful sunny day, the Italian tricolour proudly waves outside the historic walls, echoing the castle's rich heritage.;2022;conegliano-city-castle-builidng-tree
DSC_2341;Conegliano;In the enchanting gardens of Conegliano Castle, as the sun begins to set, the well becomes a focal point surrounded by lush greenery, bushes, and elegant cypresses, creating a tranquil atmosphere.;2022;conegliano-city-castle-builidng-tree-garden
DSC_2360;Conegliano;Overlooking Conegliano from the hills, a picturesque scene unfolds with a blossoming cherry tree on the left and the sun casting its warm glow on the right, creating a serene moment in the city's embrace.;2022;coneglisno-city-view-building-house-tree-flower-sunset
DSC_1042;Blackberry;Amidst the grayscale landscape, a single red blackberry bursts with color, a vibrant contrast against the muted tones of black and white.;2022;garden-blackberry-tree-detail-nature
DSC_1209;Flower;In a monochromatic world, a solitary blue flower emerges, a captivating splash of color against the canvas of black and white.;2022;flower-padova-botanic-garden-detail-nature-botanic garden-blue
DSC_1226;Flower;In a world muted by shades of gray, the vibrant orange flower stands as a vivid testament to nature's resilience and beauty.;2022;flower-padova-botanic-garden-detail-nature-botanic garden-yellow-orange
DSC_1249;Flower;In a monochrome dance, the cream-colored lotus delicately emerges, a timeless beauty amid the muted tones of black and white.;2022;flower-padova-botanic-garden-detail-nature-botanic garden-yellow
DSC_1254;Flower;Vivid passion frozen in time – a red flower speaks volumes against the canvas of black and white, a silent symphony of contrasts.;2022;flower-padova-botanic-garden-detail-nature-botanic garden-red
DSC_1294;Flower;Nature's ballet: a solitary red flower gracefully suspended by a branch, stealing the spotlight against a backdrop of timeless black and white elegance.;2022;flower-padova-botanic-garden-detail-nature-botanic garden-red
DSC_1305;Flower;Blossoming brilliance: a captivating yellow flower takes center stage in a monochrome world, a vibrant burst amid the subdued tones of black and white.;2022;flower-padova-botanic-garden-detail-nature-botanic garden-yellow
DSC_3365;Lake Olbe;At the bottom of a serene basin, a flock of sheep meanders along a winding trail, making their way to the Olbe Lakes. The gentle slope of the basin cradles them as they move, their soft, woolly forms dotting the vibrant green meadow like puffs of white cotton. The shepherd, a solitary figure, guides them with calm, practiced ease, his presence a reassuring constant in the pastoral scene.;2022;mountain-nature-lake-summer-sky-lake-olbe-tree-animal
DSC_3371;Lake Olbe;The path up the mountain to reach the Olbe Lakes is a breathtaking journey through diverse landscapes, each offering its own unique charm and challenges. Starting at the trailhead, the path winds through a dense forest of towering pine and spruce trees, their canopies forming a lush green tunnel that filters the sunlight into soft, dappled patches on the forest floor. The air here is cool and fragrant with the scent of pine needles and earth.;2022;mountain-nature-lake-summer-sky-lake-olbe-tree-path
DSC_3392;Lake Olbe;In a peaceful meadow bathed in the warm afternoon sunlight, two cows lie on the soft, verdant grass, embodying tranquility. Their large, gentle eyes are half-closed in contentment, and their bodies, substantial yet graceful, are nestled comfortably against the earth. The grass around them is lush and green, interspersed with wildflowers that add splashes of color to the scene.;2022;mountain-nature-lake-summer-sky-lake-olbe-tree-landscape-animal
DSC_3400;Lake Olbe;Lake Olbe lies nestled like a sparkling gem amid the rugged splendor of the high alpine terrain. The water is crystalline, reflecting the cerulean sky and the jagged peaks that surround it. A sense of serene isolation envelops the area, broken only by the gentle lapping of the water against the rocky shoreline.Perched on a small hill overlooking the lake is a quaint, elevated church. Its whitewashed walls and red-tiled roof stand out vividly against the natural backdrop, creating a striking contrast. The church, though modest in size, exudes a quiet dignity, with its steeple pointing skyward, as if reaching for the heavens. A narrow, winding path leads up to it, bordered by wildflowers and hardy alpine grasses.;2022;mountain-nature-lake-summer-sky-lake-olbe-tree-landscape-church-landscape
DSC_3401;Lake Olbe;Lake Olbe rests serenely in a high alpine basin, its crystal-clear waters glistening under the sun's gentle embrace. The lake’s surface mirrors the deep blue of the sky, interspersed with the delicate reflections of passing clouds. Framing this tranquil expanse of water are meadows dotted with vibrant wildflowers, their colors adding a lively contrast to the emerald grasses that slope gently down to the lake’s edge.;2022;mountain-nature-lake-summer-sky-lake-olbe-tree-landscape-landscape
DSC_3403;Lake Olbe;In the distance, an impressive expanse of mountains rises majestically against the sky, their peaks shrouded in mist and tinged with the golden hues of the setting sun. The rugged terrain stretches endlessly, a testament to nature's grandeur and timeless beauty. On the nearest mountain, a winding trail cuts through the landscape, beckoning adventurers to traverse its path. The trail, framed by lush greenery and rocky outcrops, leads the eye upwards, inviting exploration and promising breathtaking vistas at every turn. This picturesque scene captures the serene yet awe-inspiring essence of the mountainous wilderness.;2022;mountain-nature-lake-summer-sky-lake-olbe-tree-landscape-landscape
DSC_2843;Lake Cornino;Lake Cornino, nestled in the serene landscape, boasts a mesmerizing array of colors. Its waters shimmer with a vibrant, almost surreal turquoise hue, reminiscent of precious gemstones. As sunlight dances on the surface, shades of emerald and azure intermingle, creating a dynamic palette that changes with the angle of the light and the time of day. The lake's clarity enhances its striking color, revealing the intricate patterns of stones and aquatic plants beneath. This vivid display of natural beauty makes Lake Cornino a captivating and unforgettable sight.;2022;mountain-nature-lake-summer-sky-lake-cornino-tree-park national
DSC_2849;Lake Cornino;The road leading to the Lake of Cornino winds gracefully through picturesque countryside, flanked by rolling hills and verdant forests. This scenic route, lined with wildflowers and occasional glimpses of wildlife, gradually descends toward the lake, offering travelers tantalizing views of the sparkling waters ahead. Upon arrival, a charming wooden bridge spans a narrow inlet of the lake, inviting visitors to cross. The bridge, weathered yet sturdy, adds a rustic touch to the landscape. As you walk across, the gentle creaking of the wood underfoot and the serene lapping of the water below create a tranquil, immersive experience.;2022;mountain-nature-lake-summer-sky-lake-cornino-tree-park national
DSC_2860;Lake Cornino;The Lake of Cornino is a serene gem nestled in a pristine landscape, its waters shimmering with an enchanting turquoise hue. The lake's crystal-clear clarity reveals intricate details beneath the surface, from smooth pebbles to delicate aquatic plants. Surrounding the lake, a lush fringe of greenery enhances its vibrant colors. In the background, an impressive range of mountains rises majestically, their peaks touching the sky and cloaked in a gentle mist. These towering guardians, with their rugged slopes and forested valleys, form a breathtaking backdrop, creating a harmonious blend of water, greenery, and mountains that exudes tranquility and natural beauty.;2022;mountain-nature-lake-summer-sky-lake-cornino-tree-park national
DSC_3420;Lake Cadore;The mountains near Lake Cadore are a stunning testament to the grandeur of the natural world. Towering peaks rise majestically, their rugged profiles etched against the sky. These mountains are cloaked in dense forests that cascade down their slopes, giving way to craggy outcrops and alpine meadows. The higher elevations are often dusted with snow, even in summer, adding a pristine, ethereal quality to the landscape. As the mountains descend towards the lake, their reflections dance on the clear, emerald waters of Lake Cadore, creating a mirror-like effect that enhances the area's serene beauty. The interplay of light and shadow on the mountains throughout the day offers a dynamic and captivating spectacle for all who visit.;2022;mountain-nature-lake-lake of cadore-pieve di cadore-tree-landscape
DSC_3423;Lake Cadore;Lake Cadore is a serene and picturesque body of water, its surface a shimmering emerald expanse that mirrors the surrounding landscape. Nestled within the lake is a small, charming island, adding a touch of enchantment to the scene. The island is lush with greenery, dotted with a few trees whouse branches sway gently in the breeze. This tranquil oasis is a perfect focal point amid the lake's clear, calm waters. The reflections of the island and the distant, towering mountains create a captivating and harmonious panorama, making Lake Cadore a true haven of natural beauty.;2022;mountain-nature-lake-lake of cadore-pieve di cadore-tree-landscape
DSC_3430;Lake Cadore;Lake Cadore is a breathtaking expanse of clear, emerald waters, reflecting the towering mountains that surround it. These majestic peaks, with their rugged slopes and verdant forests, provide a stunning backdrop to the serene lake. On the far side of the lake, the charming city of Cadore nestles against the mountainside. Its quaint buildings, with red-tiled roofs and stone facades, create a picturesque contrast against the natural landscape. The city’s narrow streets and cozy plazas are filled with a rich history and vibrant local culture, offering a welcoming and scenic view from across the tranquil waters of the lake.;2022;mountain-nature-lake-lake cadore-pieve di cadore-tree-animal-horse-house-building
DSC_3212;Lienz;Near the quaint rail station in Lienz, an old rail locomotive stands as a nostalgic monument to a bygone era. This venerable engine, with its robust iron body and intricate mechanical details, exudes a sense of timeless charm. Its once-shiny black paint is now weathered, bearing the patina of countless journeys and the passage of time. Large spoked wheels and a prominent smokestack add to its imposing presence. The locomotive, set against the backdrop of the picturesque Lienz station with its historic architecture, offers a captivating glimpse into the rich history of rail travel in the region.;2022;lienz-city-monument-train-building
DSC_3214;Lienz;The main street in Lienz is a vibrant and charming thoroughfare that captures the essence of this picturesque Austrian town. Lined with historic buildings, each adorned with colorful facades and ornate architectural details, the street exudes a welcoming and lively atmosphere. Quaint shops, cozy cafes, and inviting restaurants spill out onto the cobblestone sidewalks, offering a delightful array of local goods and culinary treats. Flower boxes brimming with blooms add splashes of color, while the gentle hum of conversation and the occasional street musician create a cheerful ambiance. Against the backdrop of the surrounding mountains, the main street in Lienz is a perfect blend of tradition, culture, and natural beauty.;2022;lienz-city-building-house-street-mountain-people
DSC_3218;Lienz;In Lienz, a secondary street winds through the heart of the town with a quaint charm that feels like stepping back in time. Here, families have adorned their homes with colorful shutters and flower boxes overflowing with vibrant blooms. Strings crisscross between the buildings, where freshly washed clothes sway gently in the breeze, creating a tapestry of domestic life against the backdrop of the towering Alps. The street hums with a comforting sense of community, where neighbors greet each other warmly and children play games with laughter echoing through the narrow lanes. This secondary street in Lienz is a quiet haven where everyday moments of life unfold in a picturesque setting.;2022;lienz-city-building-house-street-mountain-people
DSC_3220;Lienz;The main square in Lienz is the bustling heart of this charming Austrian town, where history and modernity harmoniously converge. Flanked by elegant facades of centuries-old buildings, their pastel hues and ornate balconies adding to the square's timeless appeal. At the center, a graceful fountain stands as a focal point, its waters dancing in the sunlight. Surrounding the square, cozy cafes with outdoor seating invite visitors to savor local pastries and aromatic coffee while soaking in the vibrant atmosphere. In the evenings, the square becomes a lively hub, bustling with locals and tourists alike, drawn by the allure of live music and cultural events under the watchful gaze of the surrounding majestic mountains. The main square in Lienz embodies the essence of Austrian hospitality and cultural richness, making it a memorable destination for travelers from around the world.;2022;lienz-city-building-house-street-mountain-people-flower-tower
DSC_3223;Lienz;Liebburg Palace in Lienz stands as a stately reminder of the town's rich history and architectural splendor. Its elegant Renaissance façade, adorned with intricate stucco work and arched windows, commands attention in the heart of the city center. The palace's grand entrance, framed by ornate columns and a sweeping staircase, welcomes visitors into a world of cultural heritage and refinement. Inside, lavish halls with vaulted ceilings and opulent chandeliers speak to its former role as a residence of nobility and a center of civic life. Today, Liebburg Palace continues to serve as a cultural hub, hosting exhibitions, concerts, and community events that celebrate Lienz's vibrant past and promising future. Its timeless beauty and historical significance make Liebburg Palace a must-see landmark for anyone visiting this charming Austrian town.;2022;lienz-city-building-castle-tree-flower
DSC_2457;Marano Lagunare;Capturing the essence of the lagoon life, a casone perches on a serene islet while distant mountains and a flock of flamingos paint a tranquil scene on the canvas of the lagoon;2022;marano lagunare-city-lagoon-nature
DSC_2495;Marano Lagunare;Harbor charm in every detail - two fishing boats gracefully moored along the quay, framed by quaint houses, a winding road, and the timeless silhouette of a bell tower.;2022;marano lagunare-city-lagoon-nature-boat
DSC_2497;Marano Lagunare;Tranquil waters embrace the dance of boats in the heart of the lagoon, as a lone bark gracefully returns to its mooring, nestled between two serene strips of land.;2022;marano lagunare-city-lagoon-nature-boat
DSC_3260;3 Zinnen;The Italian mountains present a stunning tableau of natural beauty, their dramatic silhouettes etched against the horizon. In the soft light of dawn or dusk, the lower slopes are enveloped in cool, tranquil shadows, emphasizing the serene stillness of the landscape. Above, the peaks are bathed in the golden light of the sun, their rugged contours and snow-capped summits glowing with a warm, radiant brilliance. This striking contrast between shadowed valleys and sunlit crests creates a captivating scene, where the play of light and dark accentuates the mountains' majestic and timeless allure.;2022;nature-mountain-zinnen-tree
DSC_3271;River;A small waterfall cascades gently over moss-covered rocks, its waters creating a delicate silk effect as they flow. The silky strands of water glisten in the dappled sunlight, casting a serene and almost ethereal glow. Surrounding the waterfall, lush greenery and ferns thrive in the misty air, adding to the tranquil ambiance. The soft, continuous sound of the flowing water soothes the senses, making this enchanting spot a perfect haven of natural beauty and peace.;2022;nature-mountain-river-tree
DSC_3284;River;A small waterfall cascades gently over moss-covered rocks, its waters creating a mesmerizing silk effect as they flow. The delicate streams fan out gracefully, forming a translucent veil that glistens in the dappled sunlight filtering through the surrounding trees. This ethereal display is accompanied by the soothing sound of water, which harmonizes with the whisper of leaves in the breeze. The pool below, clear and inviting, captures the gentle ripples and reflections, adding to the waterfall's enchanting beauty. This serene, picturesque scene offers a tranquil retreat into nature's quiet splendor.;2022;nature-mountain-river-tree
DSC_3289;The mountain;The Italian mountains loom majestically, their slopes cloaked in deep shadow, creating a striking contrast against the landscape. Dark, brooding clouds scatter across the sky, casting an ominous yet awe-inspiring atmosphere over the scene. The rugged peaks, partially obscured by the shifting clouds, add to the dramatic effect. Occasionally, a sliver of light breaks through, highlighting the craggy ridges and revealing glimpses of the mountains' formidable beauty. This moody tableau captures the raw, untamed essence of the Italian mountains, evoking a sense of both tranquility and grandeur.;2022;mountain-nature-tree
DSC_3293;The mountain;The Italian mountains, shrouded in deep shadow, stand solemn and majestic against a dramatic sky. Dark clouds are scattered above, their heavy forms adding a sense of foreboding and mystery to the scene. The rugged peaks and forested slopes are barely illuminated, creating a striking contrast with the inky sky. Occasionally, shafts of light pierce through the clouds, casting fleeting, ghostly highlights on the mountain crests. This interplay of darkness and light enhances the mountains' imposing presence, making them appear even more formidable and awe-inspiring.;2022;mountain-nature-tree
DSC_2118;Palmanova;Golden hues embrace Palmanova's star-shaped fortifications as the sun bids farewell, casting a warm glow on history's silent guardians.;2022;palmanova-city-nature-sunset-tree-building
DSC_2126;Palmanova;Above the ramparts of Palmanova, the church stands tall, a beacon of grace against the backdrop of this unique star-shaped fortress.;2022;palmanova-city-nature-sunset-tree-building
DSC_0185;Portogruaro;In Portogruaro, a tranquil river meanders through the town, its gently flowing waters reflecting the warm hues of the buildings that line its banks. The river's surface glistens softly under the winter sun, creating a serene and picturesque scene. In the background, the historic belltower of the town rises gracefully above the rooftops, its elegant structure a prominent feature against the sky.;2022;portogruaro-city-building-river-tree-belltower-house
DSC_0194;Portogruaro;In Portogruaro, the river winds gently through the town, its surface glowing with the warm, golden hues of the winter sunset. Along the riverbank, two historic mills stand as enduring symbols of the town's rich heritage. Their weathered facades and charming architecture are bathed in the soft light of the setting sun, creating a picturesque and nostalgic scene.;2022;portogruaro-city-building-river-tree-mill-house
DSC_0680;Portogruaro;In Portogruaro, a serene river winds through the heart of the town, its calm waters reflecting the charm of the surrounding architecture. On one bank, a historic mill stands proudly, its rustic facade a testament to the town's rich heritage. The mill's large wooden wheel, though now still, hints at the industrious past of this picturesque town. In the background, the elegant belltower rises above the rooftops, its stately silhouette a prominent feature against the sky. The belltower, with its timeless architecture, adds a sense of grandeur and history to the scene. ;2022;portogruaro-city-building-river-tree-belltower-house
DSC_0699;Portogruaro;In Portogruaro, the old arcade is a charming and historic passageway that exudes timeless elegance. The arcade is lined with gracefully arched openings, supported by sturdy stone columns that have withstood the test of time. The arches create a rhythmic pattern of light and shadow along the cobblestone walkway, enhancing the arcade's enchanting atmosphere.;2022;portogruaro-city-building-house
DSC_3226;San Candido;Rocca del Baranci is a striking mountain peak nestled in the Italian Dolomites, renowned for its dramatic and rugged beauty. The towering rock formations, sculpted by millennia of natural forces, rise sharply against the sky, creating a breathtaking silhouette. The slopes are a mix of jagged cliffs, sparse alpine vegetation, and occasional patches of snow, which add to its austere charm. Often bathed in the soft light of dawn or dusk, Rocca del Baranci exudes a timeless majesty, making it a captivating destination for hikers, climbers, and nature enthusiasts seeking the serene and awe-inspiring ambiance of the high mountains.;2022;san candido-city-mountain-tree-nature-building-house
DSC_3228;San Candido;In Innichen, South Tyrol, Italy, the Holy Sepulchre Chapels are historical treasures, reflecting the town's medieval heritage and religious devotion. These chapels, inspired by Jerusalem's Holy Sepulchre, feature intricate stonework and sacred art that evoke a sense of reverence and awe. Nestled in the picturesque Dolomites, the chapels not only offer a profound spiritual journey but also stunning views of the surrounding alpine landscape, blending the divine with the natural beauty of Innichen.;2022;san candido-city-mountain-tree-nature-church-building
DSC_3231;San Candido;San Candido's main street is a charming thoroughfare that winds through the heart of this idyllic town in the Italian Alps. Glimpsing behind the houses, the main church, the Collegiate Church of San Candido, stands majestically.;2022;san candido-city-mountain-tree-nature-church-building-people-church
