name;title;description;year;tags
_DSC5495;Marostica;Journey's End: A charming long street leads the way to a picturesque church and belltower, inviting exploration and discovery at the end of the road.;2024;asolo-tree-belltower-tower-church-building-house-city
_DSC5499;Marostica;Porta Bassano: Through the arches of a medieval gateway, the road unfolds, beckoning towards the heart of Marostica's historic charm.;2024;asolo-house-building-city
_DSC5512;Marostica;Piazza Castello: An enchanting view of Palazzo Doglione and the imposing Castello Superiore, embracing the timeless beauty of Marostica's main square.;2024;asolo-hill-tree-castle-building-landscape-city-clock-belltower-clocktower
_DSC5522;Marostica;Chess under the Arcades: Bathed in soft sunlight, a timeless game unfolds beneath the historic arches, blending strategy with the warmth of the day.;2024;asolo-building-landscape-city-house-chess
_DSC5526;Marostica;Strategic Moves in the Glow: A game of chess unfolds beneath the portico, illuminated by a gentle side-light, while the lower castle gracefully emerges from an ancient archway.;2024;asolo-building-landscape-city-house-chess
_DSC5537;Bassano del Grappa;Timeless elegance: The historic Loggia di Piazza with its majestic clock, a symbol of grace in the heart of Bassano del Grappa.;2024;bassano del grappa-city-home-building-clock
_DSC5540;Bassano del Grappa;Guardian of the skyline: The stately Civica Tower standing tall in the charming cityscape of Bassano del Grappa.;2024;bassano del grappa-city-home-building-clock-belltower
_DSC5542;Bassano del Grappa;Bustling charm: Piazza Garibaldi, adorned with stands and cobbled streets, weaves a lively connection to Freedom Square in the heart of Bassano del Grappa.;2024;bassano del grappa-city-home-building-people-street
_DSC5543;Bassano del Grappa;"""Architectural allure: A charming street framed by buildings, adorned with the movement of people, leading the eye to a majestic tower at the end of the thoroughfare.";2024;bassano del grappa-city-home-building-people-street-tower
_DSC5562;Bassano del Grappa;Bassano's serenity: A picturesque view of the Brenta River from the historic Ponte Vecchio, with mountains providing a scenic backdrop to the tranquil waters.;2024;bassano del grappa-city-home-building-bridge-river-mountain-hill
_DSC5573;Bassano del Grappa;Rhino Majesty: The impressive King Kong Rhino statue stands tall, a unique presence in the heart of Bassano del Grappa, capturing attention with its majestic grandeur.;2024;bassano del grappa-city-home-building-art-sculpture
_DSC5579;Bassano del Grappa;Ponte Vecchio Pulse: A lively scene unfolds on the Ponte Vecchio, where crowds of people bring vibrant energy to the historic bridge in Bassano del Grappa.;2024;bassano del grappa-city-home-building-bridge-people
_DSC5580;Bassano del Grappa;Ponte Vecchio Pedals: Amidst the lively crowd, a person confidently strolls across the Ponte Vecchio in Bassano del Grappa, carrying a bicycle and adding a touch of urban flair to the historic bridge scene.;2024;bassano del grappa-city-home-building-bridge-people
_DSC5583;Bassano del Grappa;Charming Path to Ponte Vecchio: A quaint street adorned with houses and a prominent tower guides pedestrians towards the iconic Ponte Vecchio in Bassano del Grappa, where the timeless charm of the town unfolds.;2024;bassano del grappa-city-home-building-tower-people-tree
_DSC5589;Bassano del Grappa;Serenity on the Brenta: A close-up view captures two seagulls gracefully perched on the tranquil waters of the Brenta River, creating a serene moment in nature's embrace.;2024;bassano del grappa-city-river-animal
_DSC5591;Bassano del Grappa;Ponte Vecchio from Below: A unique perspective captures the iconic Ponte Vecchio as it spans gracefully over the Brenta River, observed from a street below, offering a captivating view almost at river level.;2024;bassano del grappa-city-home-building-tower-people-tree-river-bridge
_DSC5604;Bassano del Grappa;Elevated Elegance: A captivating view of Ponte Vecchio from above, graced by the timeless beauty of the mountains in the background.;2024;bassano del grappa-city-home-building-people-river-bridge
_DSC5610;Bassano del Grappa;Twilight in Tranquility: The sun bids adieu over Piazza in Bassano del Grappa, casting a warm glow as people enjoy shopping at stands, while lights softly illuminate a room in the nearby building.;2024;bassano del grappa-city-home-building-clock-people
_DSC5617;Asolo;Cobblestone charm in Asolo: A vintage street adorned with arches, flanked by buildings, and a lone bike parked beneath an inviting archway.;2024;asolo-city-street-building-house-path
_DSC5631;Asolo;Elegance and sunlight embrace the scene as a dancer statue graces the foreground, overlooking a sun-kissed church in the backdrop;2024;asolo-city-church-sculpture-building-animal
_DSC5642;Asolo;Romance in the air: A statue of a couple kissing on a balcony, framed by a breathtaking landscape.;2024;asolo-city-sculpture-building-house
_DSC5645;Asolo;Asolo's charm captured in rooftop details and the timeless silhouette of a bell tower against the sky.;2024;asolo-city-house-building-belltower-rooftop-tree-hill
_DSC5646;Asolo;A picturesque scene unfolds as buildings perch atop the hill, framed gracefully by the silhouette of trees in the foreground.;2024;asolo-city-house-building-tree-hill
_DSC5650;Asolo;From a small window, the building takes center stage, while the distant mountains provide a breathtaking backdrop.;2024;asolo-city-house-building-tree-mountain-landscape
_DSC5651;Asolo;Through a quaint window, the sun warmly caresses the bell tower, revealing a picturesque glimpse of the city bathed in its golden glow.;2024;asolo-city-house-building-belltower-window-tree-hill
_DSC5656;Asolo;Enchanting views unfold as the land of Asolo gracefully rises above the hill, a timeless spectacle of nature's allure.;2024;asolo-city-house-building-landscape-tree-hill
_DSC5672;Asolo;Ascending the narrow road, a sun-kissed facade peeks through, revealing a glimpse of warmth and charm along the journey.;2024;asolo-city-house-building-street-path
_DSC5673;Asolo;Asolo Castle emerges from the embrace of fog and clouds, a timeless silhouette that adds an air of mystery to the enchanting landscape.;2024;asolo-city-house-building-castle-tree
_DSC5686;Asolo;Mystical Asolo: Enveloped in a veil of fog and clouds, the enchanting landscape of Asolo takes on an ethereal charm, shrouding its hills and valleys in an atmosphere of mystery and tranquility.;2024;asolo-city-house-building-landscape-tree-hill-people
_DSC5700;Verona;Guardian of History: The imposing statue of Victor Emmanuel II stands proud in Verona, a sentinel near the iconic Arena. A symbol of unity and history, it echoes the timeless legacy of a city steeped in culture and grandeur.;2024;verona-sculpture-people-city-tree
_DSC5703;Verona;Verona's Timeless Promenade: A charming pedestrian street unfolds near the iconic Arena of Verona, where the echoes of history harmonize with the vibrant energy of modern life. An inviting stroll through the heart of a city that seamlessly blends past and present.;2024;verona-building-people-city-tree-house
_DSC5704;Verona;Verona's Tapestry: A picturesque pedestrian street framed by a glimpse of the majestic Arena and the elegant Barbieri Palace. In this harmonious blend of history and contemporary life, Verona weaves a vibrant tapestry for thouse who wander its charming streets.;2024;verona-building-people-city-tree-house
_DSC5706;Verona;Journey to Juliet's Home: Embarking on a quaint pedestrian street, where every cobblestone whispers tales of romance, leading the way to the legendary House of Giulietta. A timeless passage that beckons the hearts of thouse seeking the essence of love in Verona.;2024;verona-building-people-city-tree-house-street
_DSC5711;Verona;Bustling Elegance in Piazza delle Erbe: The lively spirit of Verona comes to life in Piazza delle Erbe, where people and vibrant stands converge in a dance of commerce and culture. A dynamic scene, where the heart of the city beats in harmony with the rhythms of daily life.;2024;verona-building-people-city-tree-house-street-tower-belltower
_DSC5717;Verona;Winter's Glow in Verona: A charming secondary pedestrian street adorned with the warm embrace of Christmas lights. Amidst the quiet cobblestones, the festive illumination adds a touch of magic, inviting all to stroll through Verona's enchanting winter wonderland.;2024;verona-building-people-city-house-street
_DSC5719;Verona;Riverside Serenity: A picturesque hamlet perched atop a gentle hill, framed by the tranquil beauty of the river below. A scene that whispers tales of quietude, inviting contemplation on the timeless charm of life beyond the river.;2024;verona-building-people-city-tree-house-street-river-hill
_DSC5722;Verona;Verona's Divided Elegance: The Adige River gracefully carves through the heart of Verona, dividing the city into a seamless tapestry of historic beauty. Bridges connect, water reflects, and life on both banks resonates with the dual charm of this enchanting Italian city.;2024;verona-building-people-city-tree-house-street-river
_DSC5723;Verona;Ethereal Silhouette: Behold the graceful back of a church, where the silent dance of architectural lines converges with the stoic presence of a timeless bell tower. A quiet tableau, inviting contemplation on the sacred elegance that graces the cityscape.;2024;verona-building-people-city-tree-church-street-belltower
_DSC5724;Verona;Architectural Harmony: Two buildings stand side by side, framed by the verdant embrace of two trees, while a majestic bell tower discreetly emerges in the background. A tableau of urban symmetry and natural allure, where man-made and organic elements converge in perfect harmony.;2024;verona-building-people-city-tree-house
_DSC5729;Verona;Winter's Embrace: A church, bathed in the soft glow of the setting sun, stands as a silent testament to the beauty of the season. The warm hues of sunlight caress the architectural details, casting a tranquil ambiance that captures the essence of the serene winter evening.;2024;verona-building-people-city-tree-church-street
_DSC5733;Verona;Verona Town Hall at Dusk: The elegant facade of Verona's town hall adorned with a warm palette of colors, capturing the last fleeting moments of daylight. As the sun bids adieu, the historic building becomes a silhouette against the canvas of the evening sky, marking the transition into a night steeped in timeless charm.;2024;verona-building-people-city-tree-street
_DSC5736;Verona;Timeless Elegance: A classic clock nestled between two graceful arches, illuminated by the soft radiance of the sun casting a warm glow from behind. A moment frozen in time, where architectural beauty meets the gentle embrace of sunlight, creating a scene that whispers stories of enduring charm.;2024;verona-building-people-city-tree-street-sunset
_DSC5736;Verona;Bustling Energy: A lively pedestrian street teeming with people, bustling with activity. In the backdrop, a towering structure catches the sun's final rays, casting a warm glow on one side. A dynamic scene where the vibrancy of city life meets the serene touch of twilight.;2024;verona-building-people-city-tree-street-house-tower
_DSC5742;Verona;Castle Radiance: Bathed in the golden hues of a warm sun, the watchtower of the castle stands as a beacon of history. The play of light and shadow accentuates its majestic silhouette, weaving a tale of timeless strength and enduring beauty.;2024;verona-building-people-city-tree-street-house-tower
_DSC5744;Verona;Within the Castle's Embrace: Stepping inside the ancient walls, a tower is bathed in the gentle warmth of the sun. A play of light and shadow unfolds, revealing the hidden tales etched in the stones, where the castle whispers stories of bygone eras under the soft glow of daylight.;2024;verona-building-people-city-tree-street-tower-sunset
_DSC5745;Verona;Cavour's Gaze: The statue of Cavour stands resolute as people stroll by, a timeless observer in the heart of the city. Amidst the rhythmic flow of passersby, the statue remains a silent testament to history, embodying the enduring spirit of the place.;2024;verona-building-people-city-tree-street-house-sculpture
_DSC5746;Verona;Autumn's Embrace: A solitary tree, adorned in fiery red leaves, leans against the outer walls, embracing the warmth of the setting sun. The juxtaposition of nature's vibrant palette against the ancient stones creates a fleeting moment of serene beauty along the historical fortifications.;2024;verona-building-people-city-tree-street-house-sunset
_DSC5749;Verona;Verona's Panorama: Captured from the castle bridge, a breathtaking panorama unfolds. The Adige River meanders beneath, cradling the city in its historic embrace. In the distance, the majestic mountains stand as silent guardians, framing the enchanting cityscape of Verona.;2024;verona-building-people-city-tree-street-house-tree-sunset-river-tower-mountain
_DSC5752;Verona;Castle Whispers: From a secret vantage point on the bridge, the sun gently caresses the tower, illuminating a portion of the castle wall. A quiet reveal of Verona's historic charm, with the Adige River flowing gracefully beneath, whispers tales of centuries past.;2024;verona-building-people-city-street-tower-sunset-river
_DSC5758;Verona;Bridging Sunset: As the sun dips below the horizon, a gentle glow envelops the bridge, casting long shadows as people traverse its path. A tranquil scene where the city and the sun bid each other goodnight, creating a captivating silhouette against the fading daylight.;2024;verona-building-people-city-street-sunset-bridge
_DSC5769;Verona;Adige Elegance: The sun bids a golden farewell, casting a warm embrace upon the tranquil Adige River. Verona's silhouette emerges against the twilight, while distant mountains stand as silent sentinels to the picturesque spectacle of a sunset along the river's gentle flow.;2024;verona-building-people-city-tree-street-house-tree-sunset-river-tower-mountain
_DSC5778;Verona;Crimson Kiss: Bathed in the golden hues of sunset, a red-leaved tree stands as a fiery sentinel, capturing the last warmth of daylight in its vibrant foliage. Nature's palette meets the evening sky in a breathtaking dance of colors.;2024;verona-building-people-city-tree-street-house-sunset
_DSC5805;Grado;Cloudy Charm of Grado: A moody atmosphere envelops the coastal town of Grado as captured from above the bridge. Amidst the clouds, boats rest peacefully, contributing to the unique character of this enchanting maritime haven.;2024;grado-city-house-building-tree
_DSC5808;Grado;Solitude Stroll: A lone figure accompanied by a small canine companion takes a quiet walk along the empty streets near the lagoon. A serene moment of companionship and introspection, where the city's hushed ambiance mirrors the tranquility of their bond.;2024;grado-city-house-building-people-animal-dog-tree
_DSC5810;Grado;Lagoon Serenity: A solitary boat rests gracefully at the quay, cradled by the tranquil waters of the lagoon. Beyond, scattered islands and quaint buildings create a picturesque backdrop, inviting contemplation in this scene of serene coastal charm.;2024;grado-lagon-boat-city-house-building-tower-tree
_DSC5811;Grado;Rainy Day Reverie in Grado: From above the bridge, the charm of Grado unfolds beneath the gentle touch of raindrops. Boats sway in the harbor, and the misty ambiance adds a poetic touch to this coastal town's allure.;2024;grado-city-house-building-boat-tree
_DSC5816;Grado;Nostalgic Rainy Ride: In the heart of Grado, a lone cyclist pedals through the rain-soaked streets, embracing the vintage charm of a coastal town on a drizzly day. A timeless moment where the weather weaves a nostalgic tapestry around the character-rich scenery.;2024;grado-city-house-building-boat-tree-people-rain
_DSC5817;Grado;Rainy Day Stroll in Grado: Amidst the soft patter of rain, resilient umbrellas dot the streets as a few individuals take a leisurely walk in the heart of Grado. The town wears a glistening sheen, and the subdued ambiance adds a touch of quiet charm to the urban scene.;2024;grado-city-house-building-boat-tree-people
_DSC5825;Grado;Iconic Grado Panorama: A harmonious blend of history and patriotism in Grado, featuring architectural gems, a proud Italian flag, and the timeless silhouette of a belltower. This snapshot captures the essence of Grado's rich heritage against a backdrop of timeless elegance.;2024;grado-city-house-building-boat-tree-people-tower-belltower-flag-statue
_DSC5828;Grado;Braving the Elements: A solitary figure takes a courageous stroll along the seafront, where the turbulent sea reflects the mood of the weather. A resilient walk against the elements, embracing the untamed beauty of a coastline in the midst of a stormy day.;2024;grado-city-house-building-sea-people-tree
_DSC5818;Grado;Timeless Elegance: A captivating black and white glimpse of the main pedestrian street in the heart of Grado. The absence of color enhances the enduring charm of the cobbled path, inviting a nostalgic stroll through the timeless elegance of this coastal town.;2024;grado-city-house-building-people-tree-blackandwhite-bw
_DSC5822;Grado;Ephemeral Grace: In the quiet monochrome of the sea, a statue immortalizes two dolphins leaping over an unseen obstacle. A timeless portrayal of marine grace and a fleeting dance captured in the silent elegance of black and white.;2024;grado-statue-sea-blackandwhite-bw-landscape
_DSC5829;Grado;Nostalgic Intersection: In the simplicity of black and white, a street nestled between two buildings reveals a scene frozen in time. An aged car rests beside the building, inviting reflections on the bygone era that graced this urban thoroughfare.;2024;grado-city-house-building-blackandwhite-bw-car
_DSC5830;Grado;Monochrome Movement: The essence of urban life captured in shades of black and white. A pedestrian street near the center becomes a timeless canvas where people, like fleeting shadows, stroll through the backdrop of a city's enduring story.;2024;grado-city-house-building-people-tree-blackandwhite-bw
_DSC5935;Miramare;In the photo of Castello di Miramare, taken through a crystal ball, the elegant castle appears inverted and beautifully framed by the reflective sphere. The castle, with its stunning white stone facade and intricate architectural details, stands majestically against the backdrop of the shimmering sea. The crystal ball enhances the scene's ethereal quality, capturing the essence of Miramare's picturesque location.;2024;castle- castello di miramare-building-crystal ball-nature-sea-tree
_DSC5945;Miramare;In the photo of Castello di Miramare, captured through a crystal ball and framed by a stone arch, the castle's majestic beauty is elegantly showcased. The crystal ball presents an inverted, miniature world, where the castle's pristine white facade and its detailed architectural elements are highlighted against the backdrop of the Adriatic Sea.;2024;castle- castello di miramare-building-crystal ball-nature-sea-tree
_DSC5948;Miramare;In the photo of Castello di Miramare taken through a crystal ball, the main façade of the castle is captured with a captivating, distorted effect. The crystal ball, leaning against a low wall, acts as a lens that magnifies and inverts the elegant white façade of the castle, with its ornate details and towering spires. The clear, reflective surface of the crystal ball highlights the castle's grandeur against the backdrop of the surrounding gardens.;2024;castle- castello di miramare-building-crystal ball-nature-sea-tree
_DSC5953;Miramare;"A branch adorned with delicate flowers at ""Castello di Miramare"" showcases the natural beauty that complements the castle's grandeur. The flowers, in full bloom, add a splash of vibrant color against the lush green foliage, creating a picturesque and serene scene. This detail captures the harmony between the meticulously maintained gardens and the historic architecture of the castle.";2024;detail-flower-garden-nature-tree-red
_DSC5957;Miramare;A branch adorned with pink flowers at Castello di Miramare highlights the delicate beauty found throughout the castle's gardens. The vibrant pink blossoms stand out against the green foliage, adding a touch of color and elegance to the surroundings. This floral detail enhances the serene and enchanting atmosphere of the castle grounds, offering a glimpse into the meticulous care given to the landscape.;2024;detail-flower-garden-nature-tree-roses
_DSC5877;Miramare;Two amateur fishermen are seen on the jetty near Castello di Miramare, enjoying a peaceful day by the sea. The jetty extends gently into the water, providing them with a prime spot to cast their lines against the backdrop of the castle’s majestic white façade. The fishermen, equipped with simple gear, are absorbed in their activity, surrounded by the serene beauty of the Adriatic Sea.;2024;people-castle- castello di miramare-harbour-sea-fishermen 
_DSC5883;Miramare;The Castello di Miramare is beautifully framed by a natural border of trees in the photo, showcasing its elegant architecture against the backdrop of the Adriatic Sea. The castle's white façade, with its ornate turrets and balconies, stands out prominently. The small harbor nearby adds to the picturesque scene, with its tranquil waters reflecting the castle and the surrounding greenery.;2024;castle- castello di miramare-harbour-sea-building-harbour-tree
_DSC5899;Miramare;A walk under the porch of Castello di Miramare offers a tranquil and enchanting experience, enhanced by the lush greenery and vibrant flowers climbing its structure. The porch, with its elegant arches and columns, provides a shaded pathway that exudes historic charm. Climbing plants and blooming flowers entwine around the pillars, creating a natural canopy of colors and fragrances.;2024;castle- castello di miramare-nature-tree-building-structure-
_DSC5900;Miramare;The fountain in front of Castello di Miramare adds a touch of elegance and serenity to the castle's already majestic setting. Positioned at the entrance, the fountain features a gracefully sculpted basin from which water gently cascades, creating a soothing and melodic sound. Surrounded by meticulously manicured gardens and framed by the castle's grand white façade, the fountain serves as a charming focal point.;2024;castle- castello di miramare-nature-tree-building-structure-fountain-sea
_DSC5917;Miramare;Inside Castello di Miramare, the view from the second floor offers a stunning glimpse of the Adriatic Sea through large windows. In front of the window, a small, elegant table is placed, adorned with two delicate glass lamps that add a touch of sophistication to the room. The soft light from the lamps complements the natural light streaming in, creating a warm and inviting atmosphere. The sea view, framed by the window, provides a serene backdrop, blending the beauty of the castle's interior with the tranquil, expansive ocean beyond.;2024;castle- castello di miramare-nature-building-structure-sea
_DSC5920;Miramare;Inside the Castello di Miramare, the refined and eclectic decor includes a captivating statue representing two Japanese people. This intricate sculpture adds an exotic and cultural touch to the castle's elegant interior. The detailed craftsmanship of the statue, depicting traditional Japanese attire and poses, contrasts beautifully with the European grandeur of the surroundings. Positioned prominently within a lavish room, the statue is a testament to the castle's collection of diverse art and artifacts.;2024;castle- castello di miramare-nature-building-structure-statue
_DSC5933;Miramare;"The photo taken aside ""Castello di Miramare"" captures the castle's stunning exterior, showcasing its majestic white stone facade adorned with ornate details and elegant turrets. Positioned against the backdrop of the Adriatic Sea, the castle stands proudly on its promontory, exuding a sense of historical grandeur. Lush gardens and manicured lawns surround the castle, adding to its picturesque setting.";2024;castle- castello di miramare-nature-tree-building-structure-sea
_DSC5984;Treviso;Following the flow of the River Sile at Treviso reveals a tranquil and picturesque journey through the heart of the city. The river, with its gentle current, winds gracefully past historic buildings, lush parks, and charming bridges. The serene waters reflect the beauty of the surrounding architecture and verdant landscapes, creating a mirror-like effect that enhances the scenic views.;2024;treviso-people-city-river-bridge-house-building
_DSC6001;Treviso;A branch adorned with vibrant red flowers captures a moment of natural beauty and elegance. The rich, crimson petals stand out vividly against the green foliage, creating a striking contrast that draws the eye. Each blossom, intricately detailed, adds a splash of color and vitality to the scene. This delicate display of red flowers on the branch exemplifies the intricate and captivating aspects of nature, offering a sense of serenity and aesthetic pleasure.;2024;detail-flower-red-nature-tree-treviso
_DSC6005;Treviso;In Treviso, a portion of a church and its bell tower rise gracefully against the cityscape. The church's architecture showcases a blend of historical styles, with ornate detailing on its facade. The bell tower, a tall and elegant structure, stands proudly beside the church, its silhouette a prominent feature of the skyline. Together, they create a harmonious composition that reflects Treviso's rich cultural and architectural heritage.;2024;treviso-chuch-belltower-city-house-building
