name;title;description;year;tags
DSC_3236;San Candido;St. Michael's Church in Innichen, nestled in the picturesque setting of the South Tyrolean Alps, is a splendid example of Gothic architecture. Its slender spire and intricate stonework stand out against the backdrop of majestic mountains. Inside, the church boasts stunning frescoes and delicate stained glass windows that bathe the interior in a kaleidoscope of colors when sunlight filters through. St. Michael's Church serves as a serene sanctuary, offering visitors a moment of peace and reflection amidst the natural beauty of the Dolomites.;2022;san candido-city-mountain-tree-nature-church-building-people
DSC_3237;San Candido;In the heart of town, a historic downtown building stands as a testament to the area's cultural heritage. Its façade, adorned with intricate architecture and traditional detailing, exudes a sense of timeless elegance. Just beyond, the Rocca dei Baranci complex rises prominently against the skyline.;2022;san candido-city-mountain-tree-nature-building-house
DSC_2823;San Daniele;The main church in San Daniele del Friuli, known as the Duomo di San Michele Arcangelo, stands as a magnificent testament to the town's rich history and architectural splendor. This impressive structure, with its grand façade, blends elements of Gothic and Renaissance styles, creating a visually striking edifice.;2022;san daniele-city- ham-building-church-street-hosue
DSC_2827;San Daniele;The belltower in San Daniele del Friuli is a striking and iconic landmark that stands proudly next to the Duomo di San Michele Arcangelo. This elegant structure reaches skyward with a sense of timeless grace, its stone facade reflecting the town's rich history.;2022;san daniele-city- ham-building-belltower-street-house
DSC_2830;San Daniele;From San Daniele del Friuli, the landscape unfolds into a captivating panorama of the Friulian countryside. The town, perched on a gentle hill, offers sweeping views of lush, rolling fields and verdant vineyards that stretch towards the horizon.;2022;san daniele-city- ham-building-church-street-house-tree
DSC_2837;San Daniele;The Church of San Daniele in Castello is a quaint and historically significant edifice nestled in the heart of Castello, a district within San Daniele del Friuli. This charming church, characterized by its simple yet elegant architecture, reflects the region’s rich cultural and religious heritage.;2022;san daniele-city- ham-building-church-street-house-tree-belltower
DSC_3168;San Pietro di Cadore;The Church of San Pietro di Cadore, captured in the serene stillness of night, emanates a tranquil and mystical aura. Lit softly by the warm glow of lampposts and gentle moonlight, its ancient stone walls and graceful bell tower stand as guardians of history and faith.;2022;san pietro in cadore-mountain-landscape-nature-tree-house-building-night
DSC_3182;San Pietro di Cadore;In the stillness of night, from the balcony, a breathtaking panorama unfolds before you. The towering silhouette of mountains looms majestically against the darkened sky, their rugged peaks outlined in silver by the glow of a rising moon. Stars twinkle like scattered diamonds, punctuating the deep blue expanse above. Below, the tranquil countryside lies bathed in a gentle nocturnal haze, its contours softened by the moonlight.;2022;san pietro in cadore-mountain-landscape-nature-tree-house-building-night-moon
DSC_3186;San Pietro di Cadore;From the balcony, the mountains stretch out in a majestic panorama, their rugged peaks adorned with patches of lingering snow even in the warmth of summer. The slopes cascade down in layers of green, dotted with pine trees that seem miniature from this height.;2022;san pietro in cadore-mountain-landscape-nature-tree-house-building
DSC_1968;San Vito al tagliamento;In San Vito al Tagliamento, the main church, known as the Chiesa di San Vito, and its adjacent belltower are prominent landmarks that capture the town’s historical and architectural charm. Together, the main church and belltower in San Vito al Tagliamento form a harmonious and evocative pair, symbolizing the town's rich cultural heritage and offering a glimpse into its architectural history.;2022;san vito al tagliamento-city-building-church-belltower
DSC_3106;Santo Stefano di cadore;As you approach Santo Stefano di Cadore, the valley unfolds in a breathtaking display of natural beauty. Towering mountains rise on either side, their peaks reaching towards the sky like ancient sentinels guarding the valley below. The slopes are lush with dense forests that cascade down to the valley floor, where small streams meander through fields and meadows dotted with wildflowers.;2022;Santo stefano di cadore-city-building-mountain-tree-home-house-nature-landscape-river
DSC_3108;Santo Stefano di cadore;;2022;Santo stefano di cadore-city-building-church-belltower-people-mountain-tree
DSC_3110;Santo Stefano di cadore;St. Stephen's Parish in Santo Stefano di Cadore is a cherished landmark steeped in history and community spirit. The parish church, with its centuries-old stone walls and graceful bell tower, stands as a testament to the town's enduring faith and cultural heritage.;2022;Santo stefano di cadore-city-building-mountain-tree-home-house-nature-landscape
DSC_3132;Sappada;The main street of Sappada is a lively and picturesque thoroughfare that captures the essence of this charming Alpine village. Lined with traditional Tyrolean-style buildings adorned with wooden balconies and vibrant flower boxes, the street exudes a welcoming atmosphere. The harmonious blend of lively activity and breathtaking natural beauty makes Sappada's main street a delightful place to experience the charm of the Italian Alps.;2022;sappada-mountain-landscape-buildng-home-building-street-people
DSC_3134;Sappada;In Sappada, a quaint secondary street winds its way between two charming old hotels, their facades rich with history and character. The street, narrow and cobblestoned, exudes a cozy, intimate ambiance. At the end of this picturesque lane, a traditional Alpine house stands proudly, its wooden structure adorned with flower boxes and intricate carvings.;2022;sappada-mountain-landscape-buildng-home-building-street-people-nature-flower
DSC_3140;Sappada;Taken from outside the city, the photo of Sappada presents a breathtaking vista. Nestled in a lush valley, the picturesque town stretches out with its charming wooden houses and traditional Tyrolean architecture. The buildings, with their flower-adorned balconies, are surrounded by verdant meadows and dense forests. Rising majestically behind the town, the imposing mountains create a dramatic backdrop, their peaks partially shrouded in a delicate veil of clouds.;2022;sappada-mountain-landscape-buildng-home-building-nature
DSC_3152;Sappada;In the photo taken just outside Sappada, the serene landscape unfolds with a golf course where a few people are seen enjoying a game. The well-manicured greens and fairways are framed by the charming town in the distance, with its traditional Tyrolean-style houses. Beyond the town, the imposing mountains rise, their rugged peaks adding a sense of grandeur to the scene. Overhead, a dark grey cloud looms, casting a dramatic contrast against the lush greenery and hinting at an impending change in weather.;2022;sappada-mountain-landscape-buildng-home-building-nature-people-sport
DSC_3323;Sappada;The mountains near Sappada are a majestic sight, their rugged peaks and steep slopes creating a dramatic and awe-inspiring landscape. Covered in dense forests of pine and fir at lower elevations, the greenery gives way to rocky outcrops and alpine meadows as the mountains ascend.;2022;sappada-mountain-landscape-tree-nature
DSC_3327;Sappada;In Sappada, a picturesque Alpine village, part of the town unfolds with its charming wooden chalets and traditional Tyrolean architecture. The streets are lined with flower-adorned balconies and quaint shops, exuding a warm and inviting atmosphere. In the background, the imposing mountains rise majestically, their rugged peaks often dusted with snow, even in the warmer months.;2022;sappada-mountain-landscape-tree-nature
DSC_3333;Sappada Vecchia;In Sappada Vecchia, a typical house is a charming example of traditional Alpine architecture. These rustic homes are characterized by their steeply pitched roofs, designed to shed heavy snowfall efficiently. The facades are often adorned with wooden shutters and intricately carved balconies that add a touch of craftsmanship and warmth.;2022;sappada-sappada vecchia-mountain-nature-tree-plant-house-building
DSC_3337;Sappada Vecchia;In Sappada Vecchia, a typical two-floor house exudes traditional Alpine charm and functionality. The structure often features a steeply pitched roof, designed to efficiently manage heavy snowfall. The exterior is usually crafted from a combination of local stone and timber, offering a warm, rustic appeal.;2022;sappada-sappada vecchia-mountain-nature-tree-plant-house-building
DSC_3344;Sappada Vecchia;Main Street in Sappada Vecchia is a picturesque and charming thoroughfare that embodies the traditional Alpine character of the village. Lined with quaint, two-story houses featuring steeply pitched roofs and wooden facades, the street exudes a warm and inviting atmosphere. The buildings often showcase intricate carvings and decorative elements, adding to the street’s historical and cultural appeal.;2022;sappada-sappada vecchia-mountain-nature-tree-plant-house-building-church
DSC_3345;Sappada Vecchia;In Sappada Vecchia, a stone house with wooden balconies embodies the timeless charm of Alpine architecture. The house is built from local stone, giving it a sturdy and rustic appearance that blends seamlessly with the surrounding mountainous landscape. The rough-hewn stonework contrasts beautifully with the smooth wooden elements.;2022;sappada-sappada vecchia-mountain-nature-tree-plant-house-building
DSC_2388;Villa Bombarda;The river that flows near Villa Bombarda in Portovecchio winds gracefully through the picturesque landscape, adding a serene and tranquil ambiance to the area. Its clear waters reflect the lush greenery and trees lining its banks, creating a mirror-like effect that enhances the natural beauty of the surroundings. The gentle flow of the river provides a soothing soundtrack, complementing the historic charm of Villa Bombarda.;2022;villa bombarda-portovecchio-nature-tree-river
DSC_2390;Villa Bombarda;The mill at Villa Bombarda in Portovecchio stands as a charming relic of the past, showcasing the area's rich historical heritage. Nestled beside the serene river, the mill's weathered stone walls and rustic wooden elements exude an old-world charm. The waterwheel, a key feature of the mill, adds a picturesque and nostalgic touch as it gently turns with the flow of the river.;2022;villa bombarda-portovecchio-nature-tree-mill
DSC_2399;Villa Bombarda;Villa Bombarda in Portovecchio is a stately and elegant residence, embodying the charm and grandeur of historical Italian architecture. The villa's facade, adorned with classic elements such as arched windows, ornate balconies, and terracotta roof tiles, reflects its rich heritage. Surrounded by lush gardens and nestled beside a serene river, the villa offers a picturesque setting that enhances its tranquil and timeless appeal. The grounds include well-maintained lawns, vibrant flower beds, and the rustic mill, adding to the property's allure.;2022;villa bombarda-portovecchio-nature-tree-mill-building
_DSC3857;Valbruna;The mountain behind Valbruna stands tall and majestic, its rugged silhouette sharply defined against the evening sky. As the sun sets behind it, the peaks are bathed in a soft, feeble light, casting long shadows across the landscape. The last rays of sunlight create a gentle glow on the mountain's crags and slopes, highlighting their textures with a warm, golden hue.;2022;valbruna-mountain-landscape-nature-building-city-house
_DSC3864;Valbruna;Valbruna is a picturesque village nestled in the Italian Alps, exuding charm with its traditional wooden houses and quaint, winding streets. The serene village is surrounded by lush greenery, with fields and meadows that come alive with vibrant wildflowers in the warmer months. Towering majestically in the background, the mountains form a stunning natural backdrop.;2022;valbruna-mountain-landscape-nature-building-city-house
_DSC3869;Valbruna;The mountain behind Valbruna stands tall and serene, its rugged silhouette now cloaked in the gentle, feeble light of the setting sun. As twilight descends, the last rays of sunlight cast a soft, golden hue on the craggy peaks, while long shadows stretch across the landscape. Above the mountains, the moon hangs in the sky, its silvery glow providing a serene contrast to the dimming daylight.;2022;valbruna-mountain-landscape-nature-building-city-house-moon
DSC_1951;Valvasone Arzene;Beyond the quaint town of Valvasone Arzene, the proud bell tower punctuates the sky, where billowing clouds create a mesmerizing seascape overhead.;2022;valvasone arzene-city-building-house-sky-belltower
DSC_1958;Valvasone Arzene;Step through time at the medieval gate, where the city center unfolds within the protective embrace of ancient walls, preserving tales of bygone eras.;2022;valvasone arzene-city-building-house-sky
DSC_1959;Valvasone Arzene;Wander through the narrow labyrinthine streets, each step revealing a glimpse of history, culminating in the imposing silhouette of the bell tower soaring above the charming buildings.;2022;valvasone arzene-city-building-house-sky-belltower
DSC_0398;Venezia;In the serene waters of the lagoon, several gondolas are gently docked, their sleek black hulls and elegant prows swaying softly with the tides. The tranquil scene is framed by the picturesque Island of San Giorgio Maggiore in the background. The island's iconic church, with its striking white façade and towering bell tower, stands prominently against the sky.;2022;venezia-lagoon-city-building-belltower-church-gondola
DSC_0410;Venezia;A single gondola glides gracefully through the calm Venetian waters, carrying an enchanted tourist. The sleek, black vessel, with its iconic curved prow, is expertly navigated by the gondolier, who stands at the stern, skillfully maneuvering with his long oar.;2022;venezia-lagoon-city-building-people-gondola
DSC_0427;Venezia;The main canal in Venice, the bustling Grand Canal, winds its way through the heart of the city, lined with historic palazzi and vibrant facades. Amidst the activity, a solitary gondola glides serenely, its gondolier expertly navigating the waters. Rising majestically above the surrounding buildings, the dome of the Church of San Simeon Piccolo dominates the skyline.;2022;venezia-lagoon-city-building-belltower-church-gondola-people
DSC_0435;Venezia;In the black and white photograph, a tranquil Venetian canal is captured in timeless elegance. The grayscale tones highlight the historic architecture and intricate details of the buildings lining the water. Along the canal, a cozy restaurant terrace is bustling with activity, as people sit at tables, engaged in lively conversation and enjoying their meals.;2022;venezia-lagoon-city-building-gondola-people
DSC_0446;Venezia;From the vantage point outside the train station, the Church of San Simeon Piccolo stands as a striking landmark in Venice. Its grand dome, covered in weathered green copper, rises majestically above the surrounding buildings.;2022;venezia-lagoon-city-building-church-boat-people
DSC_0447;Venezia;In the black and white photograph of the Church of San Simeon Piccolo, the timeless architecture is highlighted in shades of gray, emphasizing the church's grand neoclassical façade and majestic green copper dome. The intricate details of the tall columns and triangular pediment stand out in stark contrast to the surrounding monochrome.;2022;venezia-lagoon-city-building-church-people
_DSC4763;Nowhere;A spider sits gracefully in the center of its intricate web, which glistens with delicate dew droplets in the morning light. The web, a marvel of natural engineering, radiates outward in a geometric pattern, its fine threads shimmering with the soft glow of nature. The spider, with its delicate legs and precise movements, meticulously tends to its creation, demonstrating a blend of patience and skill.;2023;animal-nature-spider-arachnid-detail
_DSC4769;Nowhere;A delicate butterfly rests gently on a vibrant purple flower, its wings displaying intricate patterns and vibrant hues that complement the bloom’s rich color. The butterfly’s wings, adorned with delicate spots and stripes, create a striking contrast against the soft, velvety petals of the flower. The flower’s vivid purple, with its subtle gradients and textures, provides a stunning backdrop that highlights the butterfly’s delicate beauty.;2023;animal-nature-spider-arachnid-detail
_DSC5050;Nowhere;A group of ducks glides effortlessly across the calm surface of the lake, their smooth movements creating gentle ripples that shimmer in the sunlight. The ducks, with their varied plumage of browns, whites, and iridescent greens, add lively splashes of color to the tranquil water.;2023;animale-nature-duck-lake-mountain
_DSC4565;Castelmonte;Outside Castelmonte, the landscape is a picturesque blend of history and nature. The ancient stone walls of the hilltop sanctuary rise majestically, evoking a sense of timelessness and spiritual serenity. Surrounding the fortress-like structure, a grove of olive trees spreads out, their silver-green leaves shimmering softly in the breeze. The gnarled trunks and twisted branches of the olive trees add character and a sense of age to the scene, complementing the historic ambiance of Castelmonte.;2023;castelmomte-sanctuary-church-building-tree-mountain
_DSC4580;Castelmonte;From the vantage point of Castelmonte, the landscape unfolds in a breathtaking panorama of rolling hills and lush valleys. The distant horizon is dotted with quaint villages and verdant forests, all bathed in the soft, golden light of the setting sun. Amidst this picturesque scene, a large cross stands prominently on a distant hilltop, silhouetted against the sky;2023;castelmomte-sanctuary-church-building-tree-landscape-house-mountain
_DSC4585;Castelmonte;The streets of Castelmonte are narrow, winding pathways that exude old-world charm and history. Lined with ancient stone buildings, the streets are paved with cobblestones that have been worn smooth by centuries of footsteps. Quaint arches and rustic wooden doors add to the medieval ambiance, while climbing ivy and colorful flower boxes provide splashes of natural beauty.;2023;castelmomte-sanctuary-church-building-tree-house
_DSC3967;Cison di Valmarino;Perched majestically atop a hill in Cison di Valmarino, the castle commands a breathtaking view of the surrounding landscape. This historic fortress, with its imposing stone walls and elegant towers, exudes an aura of grandeur and timelessness. The well-preserved architecture reflects centuries of history, blending medieval strength with touches of Renaissance grace.;2023;cison di valmarino-city-castle-building-hills-tree-building
_DSC3969;Cison di Valmarino;The Church of Cison di Valmarino stands as a beacon of spiritual and architectural beauty in the heart of the village. Its elegant façade, adorned with intricate stonework and classical details, reflects a blend of historical and artistic influences. The bell tower rises gracefully, its chimes marking the passage of time for the village below.;2023;cison di valmarino-city-church-belltower-building-hills-tree-building
_DSC3978;Cison di Valmarino;This charming house features a beautiful façade of exposed brick, showcasing the warm, earthy tones and textures that lend it a rustic, timeless appeal. The bricks, meticulously arranged, create a pattern that tells of the craftsmanship involved in its construction. Large windows and a welcoming front door add to the home's inviting character. Nestled at the edge of the property, lush gardens and climbing ivy enhance its natural charm.;2023;cison di valmarino-city-church-house-building-hills-tree
_DSC4154;Cividale del Friuli;The river in Cividale del Friuli, as seen from the vantage point of the Devil's Bridge, flows serenely through the heart of the town. Its crystal-clear waters reflect the surrounding natural beauty and historic architecture, creating a picturesque scene. The riverbanks are lined with lush greenery and charming buildings that add to the idyllic atmosphere.;2023;cividale del friuli-city-house-building-tree-river
_DSC4159;Cividale del Friuli;The Devil's Bridge in Cividale del Friuli is a striking historical landmark that spans the Natisone River. This impressive stone bridge, with its elegant arches, is steeped in legend and local folklore. Constructed in the 15th century, the bridge features two sweeping arches that rise gracefully above the clear, flowing waters below.;2023;cividale del friuli-city-house-building-tree-river-bridge-church-belltower-people
_DSC4599;Cividale del Friuli;The main church in Cividale del Friuli, known as the Cathedral of Santa Maria Assunta, is a magnificent example of religious architecture and a focal point of the town's spiritual life. Its grand façade, adorned with intricate stonework and statues, exudes a sense of reverence and history. The tall bell tower rises prominently, marking the skyline and offering a beacon of faith visible from afar.;2023;cividale del friuli-city-house-building-church-tower-people-sculpture
_DSC4602;Cividale del Friuli;A narrow street in Cividale del Friuli captures the charm and history of this ancient town. Flanked by centuries-old stone buildings, the cobblestone path winds its way through the heart of the town, creating a cozy and intimate atmosphere.;2023;cividale del friuli-city-house-building-street
_DSC4783;Flower;On the rugged slopes of the mountain, a vibrant purple flower stands out against the earthy tones of the alpine landscape. Its delicate petals, a rich shade of violet, are adorned with subtle veins and a soft, velvety texture. The flower's striking color contrasts beautifully with the surrounding rocky terrain and sparse greenery.;2023;detail-mountain-flower-nature-tree
_DSC5029;Flower;Nestled among the rugged mountain terrain, a violet flower adds a delicate touch of color to the landscape. Its vibrant purple petals, soft and velvety, contrast beautifully with the surrounding rocky ground and sparse alpine vegetation. The flower’s slender, graceful stems and small, heart-shaped leaves enhance its ethereal charm. Despite the harsh mountain environment, the violet flower stands resilient, offering a burst of color and a sense of tranquility amidst the rugged, majestic scenery.;2023;detail-mountain-flower-nature-tree
_DSC5032;Flower;Amidst the rugged mountain shrubbery, a violet flower emerges with striking beauty. Its deep purple petals, velvety and vibrant, stand out against the green backdrop of the surrounding shrubs. The flower's delicate blossoms, set upon slender stems, are nestled among the dense, textured foliage. The rich violet hue creates a stunning contrast with the muted tones of the mountain environment, adding a touch of elegance and color to the wild, rugged landscape.;2023;detail-mountain-flower-nature-tree
_DSC5071;Berries;Amidst the dense shrubbery, clusters of vibrant red berries stand out vividly against the backdrop of green foliage. These small, glossy berries, bright and eye-catching, contrast sharply with the dark, textured leaves of the shrubs. Their rich red hue adds a pop of color to the landscape, creating a striking visual against the natural greens and browns of the surrounding vegetation.;2023;detail-mountain-flower-nature-berry-lake
_DSC4189;Erto;Erto is a picturesque village nestled in the rugged landscape of northern Italy. Its houses, built from local stone and timber, exude a rustic charm that reflects the area's rich heritage and traditional architecture. The structures, often two or three stories high, feature sloping roofs covered in weathered tiles, wooden balconies adorned with colorful flowers, and intricately carved wooden shutters. The narrow, winding streets of Erto are lined with these charming homes, creating a cozy and intimate atmosphere.;2023;erto-mountain-tree-house-building-landscape
_DSC4217;Erto;The narrow streets in the old center of Erto wind through a charming and historic village setting. Lined with traditional stone houses, these cobblestone pathways exude an old-world charm that transports visitors back in time. The buildings, with their weathered façades and wooden shutters, stand closely together, creating a sense of intimacy and warmth.;2023;erto-mountain-tree-house-building-landscape-street
_DSC4219;Erto;In Erto, the belltower rises gracefully above the cluster of traditional stone houses, serving as a prominent and cherished landmark. Its sturdy structure, built from the same local stone as the surrounding homes, harmonizes with the village's rustic aesthetic. The tower's elegant spire reaches towards the sky, crowned with a weathered copper roof that glints softly in the sunlight.;2023;erto-mountain-tree-house-building-landscape-street-belltower
_DSC4776;Fontanon dal Toff;Nestled between two towering mountains, a very small waterfall cascades gently down a rocky crevice. The water, clear and sparkling, tumbles over the stones, creating a soft, soothing sound that echoes through the serene landscape. The lush greenery clings to the rocks around the waterfall, adding a touch of vibrant life to the rugged surroundings.;2023;fontanon dal toff-river-mountain-nature-waterfall-tree-landscape
