name;title;description;year;tags
DSC_0037;Dog;Guardian of the Waters: This majestic dog takes a moment to enjoy the serenity while perched on the dam, a loyal companion overseeing nature's beauty.;2021;animal-landscape-dog-wild
DSC_0046;Dog;Paws on Patrol: This curious canine diligently searches the dam's expanse, a furry detective on a mission, nose to the ground, seeking adventure and discovery.;2021;animal-landscape-dog-wild
DSC_0148;Swan;Tranquil Elegance: A swan gracefully glides through the still waters of a quiet river, its serene journey reflecting the calm beauty of nature's untouched sanctuary.;2021;animal-landscape-swan-wild-river
DSC_0150;Swan;Serenity in Motion: Amidst the hushed whispers of a quiet river, a swan moves with tranquil grace, creating a poetic dance that echoes the peaceful symphony of nature.;2021;animal-landscape-swan-wild-river
DSC_0311;Swan;Winter's Silent Symphony: A swan gracefully navigates the calm waters of a quiet sea, its ethereal presence and the stillness of the winter season harmonizing in a tranquil dance of serenity.;2021;animal-landscape-swan-wild-sea
DSC_0526;turtle;Basking Trio: Three turtles soak up the warmth along the riverbank, their sun-kissed shells glistening as they indulge in a leisurely sunbath, a picturesque moment of reptilian relaxation.;2021;animal-landscape-turtle-wild-river
DSC_0579;turtle;Tranquil Traverse: A solitary turtle gracefully glides through the calm waters of a quiet river, its unhurried swim weaving a peaceful narrative in the serenity of nature's embrace.;2021;animal-landscape-turtle-wild-river
DSC_0583;turtle;Turtle Tango: A duo of turtles poised on the edge, ready to embark on a synchronized leap into the tranquil river below, capturing the whimsical elegance of their aquatic ballet.;2021;animal-landscape-turtle-wild-river
DSC_0695;Duck;Quaint River Stroll: Two ducks leisurely waddle along the peaceful riverbank, following the gentle meanders of the quiet river, a harmonious journey in search of tranquility and relaxation.;2021;animal-landscape-duck-wild-river
DSC_1029;Dog;Garden Stroll with Furry Curiosity: A delightful scene unfolds as the dog catches up with its owner in the garden, their bond evident in the unhurried steps and shared moments of curious exploration.;2021;animal-landscape-dog-wild-home
DSC_0869;Barcis;Solitude by the Lake: A lonely house stands on the tranquil shores, embraced by a symphony of trees, creating a serene haven where nature and solitude intertwine in picturesque harmony.;2021;landscape-nature-house-lake-wild-mountain-barcis
DSC_0871;Barcis;Idyllic Charm: A small town nestled at the foothills of majestic mountains, where quaint architecture meets the grandeur of nature, painting a scene of picturesque beauty and peaceful coexistence.;2021;house-home-mountain-Italy-overcast-cloud-barcis
DSC_0874;Barcis;Timeless Tranquility: Wandering through a quiet street in a small town, the charm of stone houses whispers stories of history, creating a picturesque scene where time seems to stand still.;2021;house-home-mountain-Italy-overcast-cloud-barcis
DSC_0877;Barcis;Elevated Serenity: A charming mountain village perched above the tranquil lake, where rustic beauty meets serene waters, offering a breathtaking panorama that captures the essence of peaceful mountain living.;2021;town-mountain-Italy-lake-mountain-landscape-barcis
DSC_0350;Bibione;Winter's Silence: An empty road stretches through the serene winter landscape, untouched by footsteps or tire tracks, where the hushed stillness invites contemplation and the beauty of solitude unfolds.;2021;city-beach-sea-vacation-street-building-bibione
DSC_0354;Bibione;Frosty Urban Canvas: A winter cityscape draped in tranquility, devoid of bustling crowds, where the silent snowfall transforms streets into a serene tableau, offering a moment of quiet beauty.;2021;city-beach-sea-vacation-street-building-bibione
DSC_0359;Bibione;Solitude by the Shore: A winter beach, untouched and serene, where the absence of footprints and people is accompanied by the poetic presence of a large branch near the water, echoing the quiet beauty of the season's hibernation.;2021;beach-sea-vacation-bibione
DSC_0375;Bibione;Winter's Playground Pause: A deserted winter beach, a silent playground nestled in the coastal quietude, where the absence of laughter and footprints creates a tranquil canvas for nature's serene wintry embrace.;2021;beach-sea-vacation-bibione
DSC_0376;Bibione;Bibione's Winter Wonderland: Embracing the season's hush, Biobione transforms into a tranquil winter haven, where nature's beauty and the quietude of the surroundings create a unique and serene experience.;2021;city-beach-sea-vacation-street-building-bibione
DSC_0455;Plant;Elevating Greenery: A charming hanging pot cradles a thriving plant, a suspended oasis that adds a touch of natural elegance, bringing life and greenery to new heights.;2021;plant-detail-palette
DSC_0490;Plant;Citrus Symphony: A close-up view of vibrant lemons hanging on the tree, capturing the essence of nature's artwork as sunlight paints a golden glow on these luscious fruits.;2021;plant-detail-tree-lemon-bibione
DSC_0492;Sky;Heavenly Canvas: A tranquil blue sky adorned with wisps of delicate clouds, creating a serene and timeless masterpiece above, where the boundless beauty of the heavens unfolds.;2021;sky-cloud-detail
DSC_0577;Plant;Sunny Duo in Bloom: In a home garden, two radiant flowers in hues of yellow and orange stand side by side, sharing the vibrant warmth of their petals in a colorful symphony of nature.;2021;detail-flower-yellow
DSC_1340;Udine;Gilded Majesty: A belltower, crowned with a golden statue, graces a small hill. Captured near a park, under the sheltering branches of a tree, the image reflects a moment where architectural grandeur meets the embrace of nature, framing the scene in a serendipitous dance of light and shadow.;2021;udine-city-building-tower-statute-tree
DSC_1363;Udine;Udine's Elevated Charm: Atop a small hill, the city of Udine unfolds in a captivating panorama. This aerial view captures the city's architectural beauty and cultural richness, showcasing Udine's allure from a heightened perspective.;2021;udine-city-building-tower-statute-tree-landscape-house
DSC_1365;Udine;Sculpted Elegance in Hiding: An angular perspective reveals the belltower with a golden statue, delicately concealed as if playing hide-and-seek behind a building and the foliage of a tree. A glimpse of artistic grandeur peeking through the urban tapestry;2021;udine-city-building-tower-statute-tree
DSC_1381;Udine;Udine's Alpine Vista: Perched gracefully atop a small hill, Udine unfolds against a breathtaking backdrop of majestic mountains. This aerial view captures the city's charm harmonizing with the grandeur of the surrounding alpine landscape.;2021;udine-city-building-tower-statute-tree-landscape-house-mountain
DSC_1382;Udine;Dome in Delicate Disguise: A captivating perspective unveils the architectural beauty of a dome, delicately concealed as if playing hide-and-seek behind a building and the lush foliage of a tree. A subtle dance of elements creating an intriguing visual narrative.;2021;udine-city-building-tower-statute-tree-landscape-house-dome-church
DSC_1389;Udine;Urban Waterway: A small river gracefully winds its way between two rows of buildings, creating a serene and picturesque scene in the heart of the city. A harmonious balance where nature meets urban architecture along the tranquil flow of the water.;2021;udine-city-building-tower-statute-tree-river-house
DSC_1395;Udine;Piazza Perfection: The heart of Udine comes alive in its main square, where historic charm meets bustling city life. This vibrant scene captures the essence of Piazza XX Settembre, where culture, architecture, and the pulse of the city converge in a delightful dance.;2021;udine-city-building-square
DSC_1397;Udine;Time's Radiant Embrace: Atop the tower, the clock displays not just the hour but also a mesmerizing sun within its intricate workings. A celestial touch within the hands of time, this captivating image radiates the beauty of temporal precision illuminated by the warmth of the sun's symbolic embrace.;2021;udine-city-building-tower
DSC_1415;Udine;Urban Corridor: Strolling down the street nestled between two rows of buildings, the cityscape frames a bustling corridor of life. A dynamic intersection where architecture converges, and the rhythm of daily activities unfolds against the backdrop of urban charm;2021;udine-city-building-house
DSC_1418;Udine;Sculpted Serenity: Amidst a lush park, a statue stands in silent contemplation, surrounded by a canopy of trees. A tranquil oasis where art and nature intertwine, inviting moments of reflection and repose;2021;udine-park-statute-tree
DSC_1429;Malga Fara;Journey to the Summit: The winding road beckons, leading the way to the mountain's embrace. Behind the wheel, the adventure unfolds, with the majestic silhouette of the mountain standing as a distant promise on the horizon.;2021;road-landscape-mountain-tree-car
DSC_1434;Malga Fara;Dry Riverbed Chronicles: A bridge spans the bed of a river, now dry, narrating the ebb and flow of water over time. Against the urban backdrop, the river's absence reveals a historical tale etched in the landscape.;2021;city-river-bridge-montereale valcellina-landscape-building
DSC_1436;Malga Fara;Nestled Oasis: A charming town finds solace within the embrace of nature, surrounded by a tapestry of trees. This picturesque setting epitomizes the harmony between urban living and the serene beauty of the natural world.;2021;city-river-bridge-montereale valcellina-landscape-building
DSC_1443;Malga Fara;Tranquil Reservoir: A serene lake gently cradled by a protective dyke, forming a harmonious union between nature's expanse and human engineering. A picture-perfect scene where water and infrastructure coalesce in serene equilibrium.;2021;landscape-mountain-tree-lake
DSC_1458;Malga Fara;Mountain Enchantment: A winding path ventures beneath the towering canopy of a mountain forest. Nature's cathedral, where every step leads to the heart of the wilderness, inviting explorers to discover the enchanting secrets hidden within the emerald embrace of the trees.;2021;path-mountain-tree
DSC_1461;Malga Fara;Sacred Haven in the Woods: A small stone church nestled within the mountain forest, a tranquil sanctuary where the echoes of prayers blend with the rustling leaves. An architectural gem seamlessly woven into the tapestry of nature's grandeur.;2021;church-building-church-mountain-tree
DSC_1473;Malga Fara;Nature's Peekaboo: Beyond the lush forest, the majestic mountains play a game of peekaboo, their peaks gracefully revealing themselves. A scene where the mysteries of the woods give way to the grandeur of towering summits, creating a captivating interplay between greenery and mountain majesty.;2021;landscape-mountain-tree
DSC_1501;Malga Fara;Alpine Haven: A quaint town nestled snugly beneath the protective embrace of a towering mountain. Here, the charm of urban life harmonizes with the grandeur of nature, creating a picturesque tableau at the foothills of majestic peaks.;2021;malga fara-city-andreis-landscape-building-house-mountain-tree
DSC_0586;Plant;Blossoming Elegance: A single flower on a tree gracefully heralds the arrival of spring, its delicate bloom capturing the essence of renewal and the beauty of nature awakening.;2021;detail-flower-yellow-sky
DSC_1704;Plant;Winter's Crimson Cloak: A solitary tree adorned with striking red leaves stands resilient in the winter chill, painting a vivid portrait of nature's ability to display vibrant beauty even in the quietude of the season.;2021;detail-tree-red-sky-lignano-beach-red
DSC_1694;Lignano;Winter Windsurfing Wonderland: The lively Lignano seafront transforms into a windsurfing haven during the winter season. A captivating drone view captures the thrill of adventurous souls harnessing the brisk winds, creating a dynamic spectacle against the serene backdrop of the sea.;2021;lignano riviera-sea-beach-sunny-sport-pagoda-light-mountain-people
DSC_1715;Lignano;Coastal Connection: Lignano's charm unfolds as a footbridge gracefully extends towards a solitary lighthouse in the tranquil sea, creating a captivating scene where the town and the maritime sentinel are connected by a bridge of beauty.;2021;lignano sabbiadoro-sea-beach-sunny-sport-light-lighthouse-red-plant-mountain
DSC_1717;Lignano;Seaside Harmony: Lignano's coastal allure comes to life as the lighthouse stands sentinel on the sandy beach, accompanied by the graceful presence of a sailboat. A picturesque blend of maritime charm, where land and sea converge in serene elegance.;2021;lignano sabbiadoro-sea-beach-sunny-sport-light-lighthouse-red-plant-mountain
DSC_1722;Lignano;Bridging Horizons: Walking the footbridge from Lignano to the sea's edge, where the lighthouse stands sentinel. A journey that transcends land and water, embracing the coastal allure with each step towards the maritime beacon.;2021;lignano sabbiadoro-sea-beach-sunny-sport-light-lighthouse-red-plant-mountain
DSC_1727;Lignano;Sailing Serenity: Lignano's coastal beauty captured in a single sailboat, gracefully navigating the tranquil waters. A snapshot of maritime elegance and the timeless allure of the sea.;2021;lignano sabbiadoro-sea-beach-sunny-sport-light-lighthouse-red-plant-mountain-boat
DSC_1730;Lignano;Bridging Views: From the footbridge in Lignano, a captivating panorama unfolds, revealing charming buildings and a quaint harbor. A vantage point that bridges the town's vibrancy with the serene maritime allure, capturing the essence of coastal living.;2021;lignano sabbiadoro-sea-beach-boat-sunny-sport-light-lighthouse-red-plant-mountain-sunset-sky
DSC_1732;Lignano;Skies Above Lignano: A unique perspective captures Lignano's skyline, and above the buildings, an airplane gracefully soars, creating a dynamic scene where the town's vitality meets the boundless freedom of the open sky.;2021;lignano sabbiadoro-sea-beach-sunny-sport-light-lighthouse-red-plant-mountain-sunset-airplane-sky
DSC_1742;Lignano;Scenic Path to Tranquility: The inviting road in Lignano leads to a hidden terrace, offering a mesmerizing view of the lagoon. A journey that unfolds the town's charm and culminates in a serene vista, inviting moments of contemplation by the water's edge.;2021;lignano sabbiadoro-tree-red-road-sea-beach-sunny-sport-light-lighthouse-plant-mountain-sunset-sky
DSC_1748;Lignano;Panoramic Perch: From the enchanting terrace in Lignano, soak in the breathtaking view of the lagoon, the quaint harbor, and the majestic mountains on the horizon. A perfect spot to savor the beauty that unfolds where land and water meet.;2021;lignano sabbiadoro-lagoon-sunset-mountain-sea-beach-sunny-sport-light-lighthouse-red-plant-mountain-sunset-airplane-sky
DSC_1152;Padova;Market Magic: Follow the quaint charm of a small street that winds its way to the heart of the village square, where the bustling market awaits, offering a delightful fusion of community spirit and local treasures.;2021;padova-street-building-house-square-Italy-city-square-palace
DSC_1154;Padova;Silent Arcades: The closed indoor market under the protective arcades stands still, a quiet sanctuary where a few people stroll, creating a scene frozen in time, where the echoes of daily life linger in the hushed ambiance.;2021;padova-street-building-house-square-Italy-city-gallery-people-inside
DSC_1156;Padova;Sipping Serenity: The street comes alive as people leisurely take a break, enjoying coffee at an inviting external bar. A snapshot of urban relaxation and community, where the city's rhythm harmonizes with the simple joys of a coffee moment.;2021;padova-street-building-house-Italy-city-people
DSC_1161;Padova;Spiritual Splendor in Padova: The venerable silhouette of an abbey graces the landscape of Padova, embodying centuries of spiritual heritage. A timeless symbol of tranquility and architectural grace nestled within the vibrant cityscape.;2021;padova-street-building-house-Italy-city-people-church-square-basilica-saint-square-saint-abbey
DSC_1163;Padova;Prato of the Valle: A mesmerizing sight in Padova, where the expansive Prato of the Valle unveils a congregation of statues amid lush greenery. A symphony of art and nature, this iconic square captures the essence of Padova's cultural and historical richness.;2021;padova-street-building-house-Italy-city-people-square-basilica-saint-park-green
DSC_1181;Padova;Sacred Presence near Prato: A historic church stands in quiet reverence near the Prato of the Valle in Padova. Amidst the statues and greenery, this architectural gem weaves its spiritual thread into the rich tapestry of Padova's cultural heritage.;2021;padova-street-building-house-Italy-city-people-park-green-abbey
DSC_1327;Padova;Piazza dei Signori: The vibrant heart of Padova unfolds in its main square, adorned by the imposing Palace of Reason. Here, history and contemporary life converge, creating a dynamic tableau where the echoes of the past resonate in harmony with the pulse of the present.;2021;padova-street-building-house-Italy-city-people-mansion
DSC_1330;Padova;Timeless Views from Piazza: Gazing across Piazza dei Signori, the iconic clocktower stands as a sentinel, measuring the passage of time in the heart of Padova. A visual symphony where the city's history and the ticking clock weave together in the fabric of everyday life.;2021;padova-street-building-house-Italy-city-people-clocktower-tower-clock
DSC_1333;Padova;Nature's Embrace: A charming building adorned with ivy, nature's delicate tapestry, gracefully covering its facades. A picturesque scene where architectural elegance merges with the organic beauty of climbing vines, creating a harmonious blend of man-made and natural allure.;2021;padova-street-building-house-Italy-city-green
DSC_1200;Padova;Duo of Elegance: Two violet flowers, delicate and vibrant, share a fleeting moment in nature's canvas. A botanical dance where the beauty of simplicity is celebrated in the graceful presence of these ephemeral blossoms.;2021;padova-garden-botanical-botanic-flower-university-study-research-biology-biodiversity
DSC_1201;Padova;Serene Harmony: Purple flowers grace the edge of a tranquil pond in Padova, creating a scene of botanical serenity. In the background, a church stands as a timeless backdrop, blending the beauty of nature and architectural splendor in a harmonious composition.;2021;padova-garden-botanical-botanic-flower-abbey-building-university-study-research-biology-biodiversity
DSC_1208;Padova;Nature's Elegance: A close-up on the intricate details of a beautiful blue flower, where each delicate petal tells a story of nature's artistry. A mesmerizing study in botanical elegance and vibrant hues.;2021;padova-garden-botanical-botanic-flower-university-study-research-biology-biodiversity
DSC_1225;Padova;Citrus Bloom Delight: An up-close glimpse of the intricate details of an orange flower, where nature's precision and vibrant hues converge in a captivating display. A close encounter with the beauty woven into every petal.;2021;padova-garden-botanical-botanic-flower-university-study-research-biology-biodiversity
DSC_1251;Padova;Succulent Haven: Within the confines of a lush greenhouse, a vibrant collection of succulent plants thrives, creating a verdant sanctuary. A symphony of textures and shades, this miniature desert oasis showcases nature's resilience and exquisite beauty.;2021;padova-garden-botanical-botanic-flower-university-study-research-biology-biodiversity
DSC_1254;Padova;Red Radiance Amidst Neutrals: In a world of subdued tones, a singular red flower commands attention with its vibrant presence. A captivating detail that stands out, offering a burst of color in an otherwise colorless canvas.;2021;padova-garden-botanical-botanic-flower-university-study-research-biology-biodiversity
DSC_0202;Nowhere;Silhouetted Serenity: A tranquil moment before the winter sunset, where the orange hues cast a warm glow across the landscape. The sun, gently veiled behind a tree, paints the sky with a canvas of vibrant colors, inviting serenity and contemplation.;2021;countryside-sunset-sun-nature-tree-plant
DSC_0209;Nowhere;Winter's Glow on River Reeds: In the waning light of a winter sunset, the intricate details of two river reeds stand silhouetted against the warm hues of the evening sky. Nature's delicate dance with the fading light creates a captivating tapestry along the water's edge.;2021;countryside-sunset-sun-nature-tree-plant-detail-sunset-river-summer
DSC_0211;Nowhere;Frosty Silhouettes: As winter's embrace settles along the river, the setting sun casts enchanting silhouettes behind the skeletal branches. A serene and chilly evening, where nature and the season conspire to paint a breathtaking winter sunset.;2021;countryside-sunset-sun-nature-tree-plant-detail-sunset-river-summer
DSC_0230;Nowhere;Winter's Melancholy Farewell: A somber sunset in the desolate fields, where the fading light casts a melancholic palette across the wintry landscape. Nature's quiet introspection as the day bids a wistful farewell, painting the sky with hues of solitude.;2021;countryside-sunset-sun-nature-tree-plant-detail-sunset-summer
DSC_0235;Nowhere;Winter's Embrace: The sky ablaze with hues of soft pastels as the sun bids adieu to the winter day. A serene and enchanting winter sunset, where nature weaves a tapestry of calm and quiet beauty across the fading horizon.;2021;countryside-sunset-sun-nature-tree-plant-detail-sunset-summer
DSC_0248;Nowhere;Abbey's Winter Reverie: A tranquil winter sunset graces the fields near a river, casting its gentle glow behind the venerable Abbey of Summaga. Nature and history converge in a picturesque tableau, where the fading light whispers tales of serene evenings.;2021;countryside-sunset-sun-nature-tree-plant-detail-sunset-river-summer
DSC_2146;Aquileia;Evening Illumination: A historical monument takes center stage, bathed in a soft glow from below, resembling the luminance of a distant lighthouse.;2022;aquileia-city-night-mausoleum-building
DSC_2159;Aquileia;Evening Serenity: Acquileia's timeless beauty captured in the soft evening glow, where an ancient abbey and belltower stand as guardians of the past.;2022;aquileia-city-night-mausoleum-building-basilica-clocktower-belltower
DSC_2161;Aquileia;Evening Stroll: A charming footpath embraced by a narrow row of trees, with buildings on one side and the warm glow of two street lamps casting a gentle light from a local establishment.;2022;aquileia-city-night-light-building-path
DSC_2072;Pordenone;Pordenone is a charming town characterized by its mix of historical and modern architecture. The streets are lined with colorful buildings, quaint shops, and inviting cafes that contribute to its vibrant atmosphere. Dominating the skyline is the peak of the belltower, rising elegantly above the surrounding structures. This iconic tower, with its pointed spire, serves as a striking focal point and a navigational landmark within the town.;2022;pordenone-city-building-house-belltower-path-streer
DSC_2078;Pordenone;The Holy Trinity Church in Pordenone is bathed in a warm, golden light during the winter, casting a cozy and inviting glow over its historic facade. The church's elegant architecture, with its tall, graceful spire and intricate stonework, is beautifully highlighted by the soft, winter sunlight. This warm light accentuates the details of the church's design, from the arched windows to the decorative carvings, creating a picturesque and serene scene.;2022;pordenone-city-building-church-tree-path
DSC_2098;Pordenone;Near the Theatre in Pordenone, a building adorned with vibrant street art captures the eye. The artwork, a burst of color and creativity, transforms the otherwise ordinary facade into a dynamic canvas. Bold murals, intricate designs, and expressive graffiti blend harmoniously, reflecting the artistic spirit of the area.;2022;pordenone-city-building-buildind-tree-path-art
DSC_3084;Auronzo;A Rainy Day by Lago di Auronzo: The serene lake unfolds, mirroring the majesty of the surrounding mountains under a gentle rain.;2022;auronzo-lake-mountain-rain-cloud-nature-tree-path-building
DSC_3090;Auronzo;Clouds Embrace Lago di Auronzo: A picturesque view of the lake, with a charming cityscape and majestic mountains in the background, under the embrace of cloudy skies.;2022;auronzo-lake-mountain-rain-cloud-nature-building-house-boat-city
DSC_3091;Auronzo;City by the Shores: A serene lakeside scene near Lago di Auronzo, where the city meets the tranquil waters, set against the backdrop of majestic mountains on a cloudy day.;2022;auronzo-lake-mountain-rain-cloud-nature-building-house-city
DSC_3094;Auronzo;Auronzo's Overcast Charm: Navigating the elevated streets, the city of Auronzo unveils its quaint beauty, adorned with charming houses, all beneath a cloudy, atmospheric sky.;2022;auronzo-lake-mountain-rain-cloud-nature-building-house-city
_DSC3842;Camporosso in Valcanale;Camporosso in Valcanale: A picturesque hamlet nestled in the embrace of the land, with majestic mountains providing a breathtaking backdrop.;2022;camporosso in valcanale-city-mountain-nature-landscape-winter-house-tree
_DSC3845;Camporosso in Valcanale;Cozy suburban evenings: A row of houses, one warmly illuminated with a fireplace, set against the backdrop of the mountains adorned with the beginning of a pine forest.;2022;camporosso in valcanale-city-mountain-nature-landscape-winter-house-tree-home
